{
    "citations": [
        {
            "Z": [
                1,
                2,
                3,
                4,
                5,
                6,
                7,
                8,
                9,
                10,
                11,
                12,
                13,
                14,
                15,
                16,
                17,
                18,
                19,
                20,
                31,
                32,
                33,
                34,
                35,
                36,
                53
            ],
            "orginal": ".  Elements                             References --------                             ----------",
            "valid": false
        },
        {
            "Z": [
                1,
                3,
                4,
                5,
                6,
                7,
                8,
                9,
                10
            ],
            "authors": [
                "R. Krishnan",
                "J.S. Binkley",
                "R. Seeger",
                "J.A. Pople"
            ],
            "journal": "J. Chem. Phys.",
            "orginal": "R. Krishnan, J.S. Binkley, R. Seeger and J.A. Pople, J. Chem. Phys. 72, 650 (1980)",
            "page": 650,
            "title": false,
            "valid": true,
            "volume": 72,
            "year": 1980
        },
        {
            "Z": [
                11,
                12,
                13,
                14,
                15,
                16,
                17,
                18
            ],
            "authors": [
                "A.D. McLean",
                "G.S. Chandler J. Chem. Phys."
            ],
            "journal": false,
            "orginal": "A.D. McLean and G.S. Chandler J. Chem. Phys. 72, 5639, (1980).",
            "page": 5639,
            "title": false,
            "valid": true,
            "volume": 72,
            "year": 1980
        },
        {
            "Z": [
                19,
                20
            ],
            "authors": [
                "J-P. Blaudeau",
                "M. P. McGrath",
                "L.A. Curtiss",
                "L. Radom"
            ],
            "journal": "J. Chem. Phys.",
            "orginal": "J-P. Blaudeau, M. P. McGrath, L.A. Curtiss and L. Radom, J. Chem. Phys. 107, 5016 (1997).",
            "page": 5016,
            "title": false,
            "valid": true,
            "volume": 107,
            "year": 1997
        },
        {
            "Z": [
                31,
                32,
                33,
                34,
                35,
                36
            ],
            "authors": [
                "L. A. Curtiss",
                "M. P. McGrath",
                "J-P. Blandeau",
                "N. E. Davis",
                "R. C. Binning",
                "L. Radom"
            ],
            "journal": "J. Chem. Phys.",
            "orginal": "L. A. Curtiss, M. P. McGrath, J-P. Blandeau, N. E. Davis, R. C. Binning, Jr. L. Radom, J. Chem. Phys. 103, 6104 (1995).",
            "page": 6104,
            "title": false,
            "valid": true,
            "volume": 103,
            "year": 1995
        },
        {
            "Z": [
                53
            ],
            "orginal": "M.N. Glukhovstev, A. pross, M.P. McGrath, L. Radom, J. Chem. Phys. 103, 1878 (1995) 6-311G* Polarization Functions ------------------------------ Elements                            Reference",
            "valid": false
        },
        {
            "Z": [
                1,
                2
            ],
            "orginal": "(1p) R. Krishnan, J.S. Binkley, R. Seeger and J.A. Pople, J. Chem.",
            "valid": false
        },
        {
            "Z": [
                3,
                4,
                5,
                6,
                7,
                8,
                9,
                10
            ],
            "authors": [
                "1d Phys."
            ],
            "journal": false,
            "orginal": "(1d) Phys. 72, 650 (1980).",
            "page": 650,
            "title": false,
            "valid": true,
            "volume": 72,
            "year": 1980
        },
        {
            "Z": [
                -1
            ],
            "orginal": "This basis uses 5-component d functions. This collection of polarization functions was chosen to give the lowest possible energy for the atomic ground states in frozen core UMP2 calculations. For Be all exponents were optimized for the 1s2 2s1 2p1 excited 2-P state.",
            "valid": false
        }
    ],
    "original": "Elements                             References\n--------                             ----------\nH He Li Be B C N O F Ne Na Mg Al Si P S Cl Ar K Ca Ga Ge As Se Br Kr I:  .\n\nElements                             References\n--------                             ----------\nH, Li - Ne: R. Krishnan, J.S. Binkley, R. Seeger and J.A. Pople,\nJ. Chem. Phys. 72, 650 (1980)\nNa - Ar:    A.D. McLean and G.S. Chandler J. Chem. Phys. 72, 5639, (1980).\nK  - Ca:    J-P. Blaudeau, M. P. McGrath, L.A. Curtiss and L. Radom,\nJ. Chem. Phys. 107, 5016 (1997).\nGa - Kr:    L. A. Curtiss, M. P. McGrath, J-P. Blandeau, N. E. Davis,\nR. C. Binning, Jr. L. Radom, J. Chem. Phys. 103, 6104 (1995).\nI      :    M.N. Glukhovstev, A. pross, M.P. McGrath, L. Radom, J. Chem. Phys.\n103, 1878 (1995)\n6-311G* Polarization Functions\r\n                ------------------------------\r\nElements                            Reference\r\n H - He: (1p) R. Krishnan, J.S. Binkley, R. Seeger and J.A. Pople, J. Chem.\r\nLi - Ne: (1d) Phys. 72, 650 (1980).\r\nNote: This basis uses 5-component d functions.\r\nThis collection of polarization functions was chosen to give the lowest\r\npossible energy for the atomic ground states in frozen core UMP2 \r\ncalculations. For Be all exponents were optimized for the 1s2 2s1 2p1\r\nexcited 2-P state.\n\n",
    "valid": true
}