{
    "citations": [
        {
            "Z": [
                1,
                2
            ],
            "orginal": "W.J. Hehre, R. Ditchfield and J.A. Pople, J. Chem. Phys. 56,",
            "valid": false
        },
        {
            "Z": [
                3,
                4,
                5,
                6,
                7,
                8,
                9,
                10
            ],
            "authors": [
                "2257 1972. Note: Li",
                "B come from J.D. Dill",
                "J.A. Pople"
            ],
            "journal": "J. Chem. Phys.",
            "orginal": "2257 (1972).  Note: Li and B come from J.D. Dill and J.A. Pople, J. Chem. Phys. 62, 2921 (1975).",
            "page": 2921,
            "title": "e",
            "valid": true,
            "volume": 62,
            "year": 1975
        },
        {
            "Z": [
                11,
                12,
                13,
                14,
                15,
                16,
                17,
                18
            ],
            "authors": [
                "M.M. Francl",
                "W.J. Petro",
                "W.J. Hehre",
                "J.S. Binkley",
                "M.S. Gordon",
                "D.J. DeFrees",
                "J.A. Pople"
            ],
            "journal": "J. Chem. Phys.",
            "orginal": "M.M. Francl, W.J. Petro, W.J. Hehre, J.S. Binkley, M.S. Gordon, D.J. DeFrees and J.A. Pople, J. Chem. Phys. 77, 3654 (1982)",
            "page": 3654,
            "title": false,
            "valid": true,
            "volume": 77,
            "year": 1982
        },
        {
            "Z": [
                19,
                20,
                21,
                22,
                23,
                24,
                25,
                26,
                27,
                28,
                29,
                30
            ],
            "authors": [
                "V. Rassolov",
                "J.A. Pople",
                "M. Ratner",
                "T.L. Windus"
            ],
            "journal": "J. Chem. Phys.",
            "orginal": "V. Rassolov, J.A. Pople, M. Ratner and T.L. Windus, J. Chem. Phys. 109, 1223 (1998)",
            "page": 1223,
            "title": false,
            "valid": true,
            "volume": 109,
            "year": 1998
        },
        {
            "Z": [
                -1
            ],
            "orginal": "He and Ne are unpublished basis sets taken from the Gaussian program  Polarization functions ----------------------",
            "valid": false
        },
        {
            "Z": [
                3,
                4,
                5,
                6,
                7,
                8,
                9,
                10
            ],
            "authors": [
                "P.C. Hariharan",
                "J.A. Pople"
            ],
            "journal": false,
            "orginal": "P.C. Hariharan and J.A. Pople, Theoret. Chimica Acta 28, 213 (1973).",
            "page": 213,
            "title": false,
            "valid": true,
            "volume": 28,
            "year": 1973
        },
        {
            "Z": [
                11,
                12,
                13,
                14,
                15,
                16,
                17,
                18
            ],
            "authors": [
                "M.M. Francl",
                "W.J. Petro",
                "W.J. Hehre",
                "J.S. Binkley",
                "M.S. Gordon",
                "D.J. DeFrees",
                "J.A. Pople"
            ],
            "journal": "J. Chem. Phys.",
            "orginal": "M.M. Francl, W.J. Petro, W.J. Hehre, J.S. Binkley, M.S. Gordon, D.J. DeFrees and J.A. Pople, J. Chem. Phys. 77, 3654 (1982).",
            "page": 3654,
            "title": false,
            "valid": true,
            "volume": 77,
            "year": 1982
        },
        {
            "Z": [
                19,
                20,
                21,
                22,
                23,
                24,
                25,
                26,
                27,
                28,
                29,
                30
            ],
            "authors": [
                "V. Rassolov",
                "J.A. Pople",
                "M. Ratner",
                "T.L. Windus"
            ],
            "journal": "J. Chem. Phys.",
            "orginal": "V. Rassolov, J.A. Pople, M. Ratner and T.L. Windus, J. Chem. Phys. 109, 1223 (1998)",
            "page": 1223,
            "title": false,
            "valid": true,
            "volume": 109,
            "year": 1998
        },
        {
            "Z": [
                -1
            ],
            "orginal": "He and Ne are unpublished basis sets taken from Gaussian.  Pople-style Diffuse Functions ------------------------------ Elements                    References",
            "valid": false
        },
        {
            "Z": [
                1
            ],
            "orginal": "(1s)     T. Clark, J. Chandrasekhar, G.W. Spitznagel and P. von R.",
            "valid": false
        },
        {
            "Z": [
                3,
                4,
                5,
                6,
                7,
                8,
                9,
                10
            ],
            "authors": [],
            "journal": "1p) Schleyer. J. Comp. Chem.",
            "orginal": "(1s,1p)  Schleyer. J. Comp. Chem. 4, 294 (1983).",
            "page": 294,
            "title": "(1s",
            "valid": true,
            "volume": 4,
            "year": 1983
        },
        {
            "Z": [
                11,
                12,
                13,
                14,
                15,
                16,
                17,
                18
            ],
            "orginal": "(1s,1p)  R. Krishnam, J.S. Binkley, R. Seeger, J.A. Pople, J. Chem. Phys. 72, 650 (1980). P.M.W. Gill, B.G. Johnson, J.A. Pople and M.J. Frisch, Chem. Phys. Lett. 197, 499 (1992). These exponents were optimized for 8 small anions using the 3-21G basis set at the HF level of theory by Clark et al.  Frisch, Pople and Binkley reoptimized the exponents at the MP4 level for both neutral and anionic systems.  The (s,p) sets employ shared exponents for better integral speed.",
            "valid": false
        }
    ],
    "original": "Elements                             References\n--------                             ----------\nH - He: W.J. Hehre, R. Ditchfield and J.A. Pople, J. Chem. Phys. 56,\nLi - Ne: 2257 (1972).  Note: Li and B come from J.D. Dill and J.A.\nPople, J. Chem. Phys. 62, 2921 (1975).\nNa - Ar: M.M. Francl, W.J. Petro, W.J. Hehre, J.S. Binkley, M.S. Gordon,\nD.J. DeFrees and J.A. Pople, J. Chem. Phys. 77, 3654 (1982)\nK  - Zn: V. Rassolov, J.A. Pople, M. Ratner and T.L. Windus, J. Chem. Phys.\n109, 1223 (1998)\nNote: He and Ne are unpublished basis sets taken from the Gaussian\nprogram\n\nPolarization functions\n----------------------\nLi - Ne: P.C. Hariharan and J.A. Pople, Theoret. Chimica Acta 28, 213 (1973).\nNa - Ar: M.M. Francl, W.J. Petro, W.J. Hehre, J.S. Binkley, M.S. Gordon, D.J.\nDeFrees and J.A. Pople, J. Chem. Phys. 77, 3654 (1982).\nK  - Zn: V. Rassolov, J.A. Pople, M. Ratner and T.L. Windus, J. Chem. Phys.\n109, 1223 (1998)\n\nNote: He and Ne are unpublished basis sets taken from Gaussian.\n\nPople-style Diffuse Functions\n------------------------------\nElements                    References\nH: (1s)     T. Clark, J. Chandrasekhar, G.W. Spitznagel and P. von R.\nLi - Ne: (1s,1p)  Schleyer. J. Comp. Chem. 4, 294 (1983).\nNa - Ar: (1s,1p)  R. Krishnam, J.S. Binkley, R. Seeger, J.A. Pople,\nJ. Chem. Phys. 72, 650 (1980).\nP.M.W. Gill, B.G. Johnson, J.A. Pople and M.J. Frisch,\nChem. Phys. Lett. 197, 499 (1992).\nThese exponents were optimized for 8 small anions using the 3-21G basis set at\nthe HF level of theory by Clark et al.  Frisch, Pople and Binkley reoptimized\nthe exponents at the MP4 level for both neutral and anionic systems.  The\n(s,p) sets employ shared exponents for better integral speed.\n\n",
    "valid": true
}