{
    "citations": [
        {
            "Z": [
                1,
                3,
                4,
                5,
                6,
                7,
                8,
                9,
                10
            ],
            "authors": [
                "R. Krishnan",
                "J.S. Binkley",
                "R. Seeger",
                "J.A. Pople"
            ],
            "journal": "J. Chem. Phys.",
            "original": "R. Krishnan, J.S. Binkley, R. Seeger and J.A. Pople, J. Chem. Phys. 72, 650 (1980)",
            "page": 650,
            "title": false,
            "valid": true,
            "volume": 72,
            "year": 1980
        },
        {
            "Z": [
                11,
                12,
                13,
                14,
                15,
                16,
                17,
                18
            ],
            "authors": [
                "A.D. McLean",
                "G.S. Chandler J. Chem. Phys."
            ],
            "journal": false,
            "original": "A.D. McLean and G.S. Chandler J. Chem. Phys. 72, 5639, (1980).",
            "page": 5639,
            "title": false,
            "valid": true,
            "volume": 72,
            "year": 1980
        },
        {
            "Z": [
                19,
                20
            ],
            "original": "J-P. Blaudeau, M. P. McGrath, L.A. Curtiss and L. Radom, J. Chem. Phys. 107, 5016 (1997).  The 6-311G* polarization functions ----------------------------------",
            "valid": false
        },
        {
            "Z": [
                3,
                4,
                5,
                6,
                7,
                8,
                9,
                10,
                11,
                12,
                13,
                14,
                15,
                16,
                17,
                18
            ],
            "authors": [
                "R. Krishnan",
                "J.S. Binkley",
                "R. Seeger",
                "J.A. Pople"
            ],
            "journal": "J. Chem. Phys.",
            "original": "R. Krishnan, J.S. Binkley, R. Seeger, J.A. Pople, J. Chem. Phys. 72, 650 (1980).",
            "page": 650,
            "title": false,
            "valid": true,
            "volume": 72,
            "year": 1980
        },
        {
            "Z": [
                19,
                20
            ],
            "original": "J-P. Blaudeau, M. P. McGrath, L.A. Curtiss and L. Radom, J. Chem. Phys. 107, 5016 (1997). The diffuse functions ---------------------",
            "valid": false
        },
        {
            "Z": [
                1
            ],
            "original": "(1s)     T. Clark, J. Chandrasekhar, G.W. Spitznagel and P. von R.",
            "valid": false
        },
        {
            "Z": [
                3,
                4,
                5,
                6,
                7,
                8,
                9,
                10
            ],
            "authors": [],
            "journal": "1p) Schleyer. J. Comp. Chem.",
            "original": "(1s,1p)  Schleyer. J. Comp. Chem. 4, 294 (1983).",
            "page": 294,
            "title": "(1s",
            "valid": true,
            "volume": 4,
            "year": 1983
        },
        {
            "Z": [
                11,
                12,
                13,
                14,
                15,
                16,
                17,
                18
            ],
            "original": "(1s,1p)  R. Krishnam, J.S. Binkley, R. Seeger, J.A. Pople, J. Chem. Phys. 72, 650 (1980). P.M.W. Gill, B.G. Johnson, J.A. Pople and M.J. Frisch, Chem. Phys. Lett. 197, 499 (1992). These exponents were optimized for 8 small anions using the 3-21G basis set at the HF level of theory by Clark et al.  Frisch, Pople and Binkley reoptimized the exponents at the MP4 level for both neutral and anionic systems.  The (s,p) sets employ shared exponents for better integral speed.",
            "valid": false
        }
    ],
    "original": "Elements                             References\n--------                             ----------   .\n\nThe 6-311G part\n---------------\n\nH, Li - Ne: R. Krishnan, J.S. Binkley, R. Seeger and J.A. Pople,\nJ. Chem. Phys. 72, 650 (1980)\nNa - Ar:    A.D. McLean and G.S. Chandler J. Chem. Phys. 72, 5639, (1980).\nK  - Ca:    J-P. Blaudeau, M. P. McGrath, L.A. Curtiss and L. Radom,\nJ. Chem. Phys. 107, 5016 (1997).\n\nThe 6-311G* polarization functions\n----------------------------------\n\nLi - Ar: R. Krishnan, J.S. Binkley, R. Seeger, J.A. Pople, J. Chem. Phys. 72,\n650 (1980).\nK  - Ca: J-P. Blaudeau, M. P. McGrath, L.A. Curtiss\nand L. Radom, J. Chem. Phys. 107, 5016\n(1997).\nThe diffuse functions\n---------------------\nH: (1s)     T. Clark, J. Chandrasekhar, G.W. Spitznagel and P. von R.\nLi - Ne: (1s,1p)  Schleyer. J. Comp. Chem. 4, 294 (1983).\nNa - Ar: (1s,1p)  R. Krishnam, J.S. Binkley, R. Seeger, J.A. Pople,\nJ. Chem. Phys. 72, 650 (1980).\nP.M.W. Gill, B.G. Johnson, J.A. Pople and M.J. Frisch,\nChem. Phys. Lett. 197, 499 (1992).\nThese exponents were optimized for 8 small anions using the 3-21G basis set at\nthe HF level of theory by Clark et al.  Frisch, Pople and Binkley reoptimized\nthe exponents at the MP4 level for both neutral and anionic systems.  The\n(s,p) sets employ shared exponents for better integral speed.\n\n\n",
    "valid": true
}