{
    "citations": [
        {
            "Z": [
                1
            ],
            "authors": [
                "T.H. Dunning"
            ],
            "journal": "J. Chem. Phys.",
            "orginal": "T.H. Dunning, Jr. J. Chem. Phys. 90, 1007 (1989).",
            "page": 1007,
            "title": false,
            "valid": true,
            "volume": 90,
            "year": 1989
        },
        {
            "Z": [
                2
            ],
            "authors": [
                "D.E. Woon",
                "T.H. Dunning"
            ],
            "journal": "J. Chem. Phys.",
            "orginal": "D.E. Woon and T.H. Dunning, Jr. J. Chem. Phys. 100, 2975 (1994).",
            "page": 2975,
            "title": false,
            "valid": true,
            "volume": 100,
            "year": 1994
        },
        {
            "Z": [
                5,
                6,
                7,
                8,
                9,
                10
            ],
            "authors": [
                "T.H. Dunning"
            ],
            "journal": "J. Chem. Phys.",
            "orginal": "T.H. Dunning, Jr. J. Chem. Phys. 90, 1007 (1989).",
            "page": 1007,
            "title": false,
            "valid": true,
            "volume": 90,
            "year": 1989
        },
        {
            "Z": [
                13,
                14,
                15,
                16,
                17,
                18
            ],
            "authors": [
                "D.E. Woon",
                "T.H. Dunning"
            ],
            "journal": "J. Chem. Phys.",
            "orginal": "D.E. Woon and T.H. Dunning, Jr.  J. Chem. Phys. 98, 1358 (1993).",
            "page": 1358,
            "title": false,
            "valid": true,
            "volume": 98,
            "year": 1993
        },
        {
            "Z": [
                31,
                32,
                33,
                34,
                35,
                36
            ],
            "authors": [
                "A.K. Wilson",
                "D.E. Woon",
                "K.A. Peterson",
                "T.H. Dunning"
            ],
            "journal": "",
            "orginal": "A.K. Wilson, D.E. Woon, K.A. Peterson, T.H. Dunning, Jr., J. Chem. Phys., 110, 7667 (1999).",
            "page": 7667,
            "title": "J. Chem. Phys.",
            "valid": true,
            "volume": 110,
            "year": 1999
        },
        {
            "Z": [
                21,
                22,
                23,
                24,
                25,
                26,
                27,
                28,
                29,
                30
            ],
            "authors": [],
            "journal": "",
            "orginal": "(20s,16p,8d,2f,1g) -> [7s,6p,4d,2f,1g]     N.B. Balabanov and K.A. Peterson, J. Chem. Phys., 123, 064107 (2005)",
            "page": 64107,
            "title": "(20s,16p,8d,2f,1g)-> [7s,6p,4d,2f,1g] N.B. Balabanov and K.A. Peterson, J. Chem. Phys.",
            "valid": true,
            "volume": 123,
            "year": 2005
        },
        {
            "Z": [
                39,
                40,
                41,
                42,
                43,
                44,
                45,
                46
            ],
            "authors": [
                "K.A. Peterson",
                "D. Figgen",
                "M. Dolg",
                "H. Stoll"
            ],
            "journal": "Journal of Chemical Physics",
            "orginal": "K.A. Peterson, D. Figgen, M. Dolg, H. Stoll, Energy-consistent relativistic pseudopotentials and correlation consistent basis sets for the 4d elements Y-Pd, Journal of Chemical Physics 126, 124101 (2007).",
            "page": 124101,
            "title": "Energy-consistent relativistic pseudopotentials and correlation consistent basis sets for the 4d elements Y-Pd",
            "valid": true,
            "volume": 126,
            "year": 2007
        }
    ],
    "original": "Original basis sets:\nElements                             References\n--------                             ----------\nH     : T.H. Dunning, Jr. J. Chem. Phys. 90, 1007 (1989).\nHe    : D.E. Woon and T.H. Dunning, Jr. J. Chem. Phys. 100, 2975 (1994).\nB - Ne: T.H. Dunning, Jr. J. Chem. Phys. 90, 1007 (1989).\nAl - Ar: D.E. Woon and T.H. Dunning, Jr.  J. Chem. Phys. 98, 1358 (1993).\nGa - Kr: A.K. Wilson, D.E. Woon, K.A. Peterson, T.H. Dunning, Jr., J. Chem. Phys., 110, 7667 (1999).\nOriginal exponents recontracted: W.A. de Jong, R.J. Harrison and D.A. Dixon, J. Chem. Phys. 114, 48 (2001).\nSc - Zn: (20s,16p,8d,2f,1g) -> [7s,6p,4d,2f,1g]     N.B. Balabanov and K.A. Peterson, J. Chem. Phys., 123, 064107 (2005)\nY Zr Nb Mo Tc Ru Rh Pd      : K.A. Peterson, D. Figgen, M. Dolg, H. Stoll, Energy-consistent relativistic pseudopotentials and correlation consistent basis sets for the 4d elements Y-Pd, Journal of Chemical Physics 126, 124101 (2007).\n\n\n",
    "valid": true
}