{
    "citations": [
        {
            "Z": [
                1,
                2,
                3,
                4,
                5,
                6,
                7,
                8,
                9,
                10,
                11,
                12,
                13,
                14,
                15,
                16,
                17,
                18
            ],
            "authors": [
                "A. Canal Neto",
                "E. P. Muniz",
                "R. Centoducatte",
                "F. E. Jorge",
                "Gaussian basis sets for correlated wave functions. Hydrogen"
            ],
            "journal": "J. Mol. Struct. (Theochem)",
            "orginal": "A. Canal Neto, E. P. Muniz, R. Centoducatte, and F. E. Jorge, Gaussian basis sets for correlated wave functions. Hydrogen, helium, first- and second-row atoms, J. Mol. Struct. (Theochem) 718, 219 (2005).",
            "page": 219,
            "title": "helium, first- and second-row atoms",
            "valid": true,
            "volume": 718,
            "year": 2005
        },
        {
            "Z": [
                19,
                20,
                21,
                22,
                23,
                25,
                26,
                27,
                28,
                29,
                30,
                31,
                32,
                33,
                34,
                35,
                36
            ],
            "authors": [
                "G. G. Camiletti",
                "S. F. Machado",
                "F. E. Jorge"
            ],
            "journal": "J. Comp. Chem.",
            "orginal": "G. G. Camiletti, S. F. Machado, and F. E. Jorge, Gaussian Basis Set of Double Zeta Quality for Atoms K Through Kr: Application in DFT Calculations of Molecular Properties, J. Comp. Chem. 29, 2434 (2008).",
            "page": 2434,
            "title": "Gaussian Basis Set of Double Zeta Quality for Atoms K Through Kr: Application in DFT Calculations of Molecular Properties",
            "valid": true,
            "volume": 29,
            "year": 2008
        },
        {
            "Z": [
                37,
                38,
                39,
                40,
                41,
                42,
                43,
                44,
                45,
                46,
                47,
                48,
                49,
                50,
                51,
                52,
                53,
                54
            ],
            "authors": [
                "C. L. Barros",
                "P. J. P. de Oliveira",
                "F. E. Jorge",
                "A. Canal Neto",
                "M. Campos"
            ],
            "journal": "Mol. Phys.",
            "orginal": "C. L. Barros, P. J. P. de Oliveira, F. E. Jorge, A. Canal Neto, and M. Campos, Gaussian basis set of double zeta quality for atoms Rb through Xe: application in non-relativistic and relativistic calculations of atomic and molecular properties, Mol. Phys. 108, 1965 (2010).",
            "page": 1965,
            "title": "Gaussian basis set of double zeta quality for atoms Rb through Xe: application in non-relativistic and relativistic calculations of atomic and molecular properties",
            "valid": true,
            "volume": 108,
            "year": 2010
        },
        {
            "Z": [
                78
            ],
            "authors": [
                "R. C. de Berr\u00eado",
                "F. E. Jorge"
            ],
            "journal": "J. Mol. Struct. (Theochem)",
            "orginal": "R. C. de Berr\u00eado, and F. E. Jorge, All-electron double zeta basis sets for platinum: Estimating scalar relativistic effects on platinum(II) anticancer drugs, J. Mol. Struct. (Theochem) 961, 107 (2010).",
            "page": 107,
            "title": "All-electron double zeta basis sets for platinum: Estimating scalar relativistic effects on platinum(II) anticancer drugs",
            "valid": true,
            "volume": 961,
            "year": 2010
        },
        {
            "Z": [
                55,
                56,
                57,
                72,
                73,
                74,
                75,
                76,
                77,
                79,
                80,
                81,
                82,
                83,
                84,
                85,
                86
            ],
            "authors": [
                "A. Canal Neto",
                "F. E. Jorge"
            ],
            "journal": "Chem. Phys. Lett.",
            "orginal": "A. Canal Neto and F. E. Jorge, All-electron double zeta basis sets for the most fifth-row atoms: Application in DFT spectroscopic constant calculations, Chem. Phys. Lett. 582, 158 (2013).",
            "page": 158,
            "title": "All-electron double zeta basis sets for the most fifth-row atoms: Application in DFT spectroscopic constant calculations",
            "valid": true,
            "volume": 582,
            "year": 2013
        }
    ],
    "original": "Elements                             References\n--------                             ----------\nH He Li Be B C N O F Ne Na Mg Al Si P S Cl Ar: A. Canal Neto, E. P. Muniz, R. Centoducatte, and F. E. Jorge, Gaussian basis sets for correlated wave functions. Hydrogen, helium, first- and second-row atoms, J. Mol. Struct. (Theochem) 718, 219 (2005).\nK Ca Sc Ti V Mn Fe Co Ni Cu Zn Ga Ge As Se Br Kr: G. G. Camiletti, S. F. Machado, and F. E. Jorge, Gaussian Basis Set of Double Zeta Quality for Atoms K Through Kr: Application in DFT Calculations of Molecular Properties, J. Comp. Chem. 29, 2434 (2008).\nRb Sr Y Zr Nb Mo Tc Ru Rh Pd Ag Cd In Sn Sb Te I Xe: C. L. Barros, P. J. P. de Oliveira, F. E. Jorge, A. Canal Neto, and M. Campos, Gaussian basis set of double zeta quality for atoms Rb through Xe: application in non-relativistic and relativistic calculations of atomic and molecular properties, Mol. Phys. 108, 1965 (2010).\nPt: R. C. de Berr\u00eado, and F. E. Jorge, All-electron double zeta basis sets for platinum: Estimating scalar relativistic effects on platinum(II) anticancer drugs, J. Mol. Struct. (Theochem) 961, 107 (2010).\nCs Ba La Hf Ta W Re Os Ir Au Hg Tl Pb Bi Po At Rn: A. Canal Neto and F. E. Jorge, All-electron double zeta basis sets for the most fifth-row atoms: Application in DFT spectroscopic constant calculations, Chem. Phys. Lett. 582, 158 (2013).\n\n\n",
    "valid": true
}