{
    "citations": [
        {
            "DOI": "10.1063/1.3072360",
            "Z": [
                1,
                2,
                3,
                4,
                5,
                6,
                7,
                8,
                9,
                10,
                11,
                12,
                13,
                14,
                15,
                16,
                17,
                18,
                19,
                20,
                21,
                22,
                23,
                24,
                25,
                26,
                27,
                28,
                29,
                30,
                31,
                32,
                33,
                34,
                35,
                36
            ],
            "authors": [
                "F. E. Jorge",
                "A. Canal Neto",
                "G. G. Camiletti",
                "S. F. Machado"
            ],
            "journal": "The Journal of Chemical Physics",
            "original": "F. E. Jorge, A. Canal Neto, G. G. Camiletti, and S. F. Machado, Contracted Gaussian basis sets for Douglas?Kroll?Hess calculations: Estimating scalar relativistic effects of some atomic and molecular properties, Journal of Chemical Physics 130, 064108 (2009).",
            "page": "064108",
            "title": "Contracted Gaussian basis sets for Douglas\u2013Kroll\u2013Hess calculations: Estimating scalar relativistic effects of some atomic and molecular properties",
            "valid": true,
            "volume": "130",
            "year": 2009
        },
        {
            "DOI": "10.1016/j.cplett.2013.07.045",
            "Z": [
                55,
                56,
                57,
                72,
                73,
                74,
                75,
                76,
                77,
                79,
                80,
                81,
                82,
                83,
                84,
                85,
                86
            ],
            "authors": [
                "A. Canal Neto",
                "F.E. Jorge"
            ],
            "journal": "Chemical Physics Letters",
            "original": "A. Canal Neto and F. E. Jorge, All-electron double zeta basis sets for the most fifth-row atoms: Application in DFT spectroscopic constant calculations, Chemical Physics Letters 582, 158 (2013).",
            "page": "158-162",
            "title": "All-electron double zeta basis sets for the most fifth-row atoms: Application in DFT spectroscopic constant calculations",
            "valid": true,
            "volume": "582",
            "year": 2013
        },
        {
            "DOI": "10.1016/j.theochem.2010.09.007",
            "Z": [
                78
            ],
            "authors": [
                "R.C. de Berr\u00eado",
                "F.E. Jorge"
            ],
            "journal": "Journal of Molecular Structure: THEOCHEM",
            "original": "R. C. de Berr\u00eado, and F. E. Jorge, All-electron double zeta basis sets for platinum: Estimating scalar relativistic effects on platinum(II) anticancer drugs, Journal of Molecular Structure: THEOCHEM 961, 107 (2010).",
            "page": "107-112",
            "title": "All-electron double zeta basis sets for platinum: Estimating scalar relativistic effects on platinum(II) anticancer drugs",
            "valid": true,
            "volume": "961",
            "year": 2010
        },
        {
            "DOI": "10.1080/00268976.2010.499377",
            "Z": [
                37,
                38,
                39,
                40,
                41,
                42,
                43,
                44,
                45,
                46,
                47,
                48,
                49,
                50,
                51,
                52,
                53,
                54
            ],
            "authors": [
                "C.L. Barros",
                "P.J.P. de Oliveira",
                "F.E. Jorge",
                "A. Canal Neto",
                "M. Campos"
            ],
            "journal": "Molecular Physics",
            "original": "C. L. Barros, P. J. P. de Oliveira, F. E. Jorge, A. Canal Neto, and M. Campos, Gaussian basis set of double zeta quality for atoms Rb through Xe: application in non-relativistic and relativistic calculations of atomic and molecular properties Gaussian basis set of double zeta quality for atoms Rb through Xe: application in non-relativistic and relativistic calculations of atomic and molecular properties, Molecular Physics 108, 1965 (2010).  ",
            "page": "1965-1972",
            "title": "Gaussian basis set of double zeta quality for atoms Rb through Xe: application in non-relativistic and relativistic calculations of atomic and molecular properties",
            "valid": true,
            "volume": "108",
            "year": 2010
        }
    ],
    "original": "Elements                             References\n--------                             ----------\nH He Li Be B C N O F Ne Na Mg Al Si P S Cl Ar K Ca Sc Ti V Cr Mn Fe Co Ni Cu Zn Ga Ge As Se Br Kr: F. E. Jorge, A. Canal Neto, G. G. Camiletti, and S. F. Machado, Contracted Gaussian basis sets for Douglas?Kroll?Hess calculations: Estimating scalar relativistic effects of some atomic and molecular properties, Journal of Chemical Physics 130, 064108 (2009).\nCs Ba La Hf Ta W Re Os Ir Au Hg Tl Pb Bi Po At Rn: A. Canal Neto and F. E. Jorge, All-electron double zeta basis sets for the most fifth-row atoms: Application in DFT spectroscopic constant calculations, Chemical Physics Letters 582, 158 (2013).\nPt: R. C. de Berr\u00eado, and F. E. Jorge, All-electron double zeta basis sets for platinum: Estimating scalar relativistic effects on platinum(II) anticancer drugs, Journal of Molecular Structure: THEOCHEM 961, 107 (2010).\nRb Sr Y Zr Nb Mo Tc Ru Rh Pd Ag Cd In Sn Sb Te I Xe: C. L. Barros, P. J. P. de Oliveira, F. E. Jorge, A. Canal Neto, and M. Campos, Gaussian basis set of double zeta quality for atoms Rb through Xe: application in non-relativistic and relativistic calculations of atomic and molecular properties Gaussian basis set of double zeta quality for atoms Rb through Xe: application in non-relativistic and relativistic calculations of atomic and molecular properties, Molecular Physics 108, 1965 (2010).\n\n\n",
    "valid": true
}