{
    "citations": [
        {
            "Z": [
                1,
                3,
                4,
                5,
                6,
                7,
                8,
                9,
                10,
                11,
                12,
                13,
                14,
                15,
                16,
                17,
                18
            ],
            "authors": [
                "P. L. Barbieri",
                "P. A. Fantin",
                "F. E. Jorge"
            ],
            "journal": "Mol. Phys.",
            "original": "P. L. Barbieri, P. A. Fantin, and F. E. Jorge, Gaussian basis sets of triple and quadruple zeta valence quality for correlated wave functions, Mol. Phys. 104, 2945 (2006).",
            "page": 2945,
            "title": "Gaussian basis sets of triple and quadruple zeta valence quality for correlated wave functions",
            "valid": true,
            "volume": 104,
            "year": 2006
        },
        {
            "Z": [
                19,
                20,
                21,
                22,
                23,
                24,
                25,
                26,
                27,
                28,
                29,
                30,
                31,
                32,
                33,
                34,
                35,
                36
            ],
            "authors": [
                "S. F. Machado",
                "G. G. Camiletti",
                "A. Canal Neto",
                "F. E. Jorge",
                "Raquel S. Jorge"
            ],
            "journal": "Mol. Phys.",
            "original": "S. F. Machado, G. G. Camiletti, A. Canal Neto, F. E. Jorge, and Raquel S. Jorge, Gaussian basis set of triple zeta valence quality for the atoms from K to Kr: Application in DFT and CCSD(T) calculations of molecular properties, Mol. Phys. 107, 1713 (2009).",
            "page": 1713,
            "title": "Gaussian basis set of triple zeta valence quality for the atoms from K to Kr: Application in DFT and CCSD(T) calculations of molecular properties",
            "valid": true,
            "volume": 107,
            "year": 2009
        },
        {
            "Z": [
                37,
                39,
                40,
                41,
                42,
                43,
                44,
                45,
                46,
                47,
                48,
                49,
                50,
                51,
                52,
                53,
                54
            ],
            "authors": [
                "C. T. Campos",
                "F. E. Jorge"
            ],
            "journal": "Mol. Phys.",
            "original": "C. T. Campos and F. E. Jorge, Triple zeta quality basis sets for atoms Rb through Xe: application in CCSD(T) atomic and molecular property calculations, Mol. Phys. 111, 167 (2013).",
            "page": 167,
            "title": "Triple zeta quality basis sets for atoms Rb through Xe: application in CCSD(T) atomic and molecular property calculations",
            "valid": true,
            "volume": 111,
            "year": 2013
        }
    ],
    "original": "Elements                             References\n--------                             ----------\nH Li Be B C N O F Ne Na Mg Al Si P S Cl Ar: P. L. Barbieri, P. A. Fantin, and F. E. Jorge, Gaussian basis sets of triple and quadruple zeta valence quality for correlated wave functions, Mol. Phys. 104, 2945 (2006).\nK Ca Sc Ti V Cr Mn Fe Co Ni Cu Zn Ga Ge As Se Br Kr: S. F. Machado, G. G. Camiletti, A. Canal Neto, F. E. Jorge, and Raquel S. Jorge, Gaussian basis set of triple zeta valence quality for the atoms from K to Kr: Application in DFT and CCSD(T) calculations of molecular properties, Mol. Phys. 107, 1713 (2009).\nRb Y Zr Nb Mo Tc Ru Rh Pd Ag Cd In Sn Sb Te I Xe: C. T. Campos and F. E. Jorge, Triple zeta quality basis sets for atoms Rb through Xe: application in CCSD(T) atomic and molecular property calculations, Mol. Phys. 111, 167 (2013).\n\n\n",
    "valid": true
}