{
    "citations": [
        {
            "DOI": "10.1063/1.3072360",
            "Z": [
                1,
                2,
                3,
                4,
                5,
                6,
                7,
                8,
                9,
                10,
                11,
                12,
                13,
                14,
                15,
                16,
                17,
                18,
                19,
                20,
                21,
                22,
                23,
                24,
                25,
                26,
                27,
                28,
                29,
                30,
                31,
                32,
                33,
                34,
                35,
                36,
                37,
                38,
                39,
                40,
                41,
                42,
                43,
                44,
                45,
                46,
                47,
                48,
                49,
                50,
                51,
                52,
                53,
                54
            ],
            "authors": [
                "F. E. Jorge",
                "A. Canal Neto",
                "G. G. Camiletti",
                "S. F. Machado"
            ],
            "journal": "The Journal of Chemical Physics",
            "original": "F. E. Jorge, A. Canal Neto, G. G. Camiletti, and S. F. Machado, Contracted Gaussian basis sets for Douglas?Kroll?Hess calculations: Estimating scalar relativistic effects of some atomic and molecular properties, Journal of Chemical Physics 130, 064108 (2009).",
            "page": "064108",
            "title": "Contracted Gaussian basis sets for Douglas\u2013Kroll\u2013Hess calculations: Estimating scalar relativistic effects of some atomic and molecular properties",
            "valid": true,
            "volume": "130",
            "year": 2009
        },
        {
            "DOI": "10.1080/00268976.2012.709282",
            "Z": [
                37,
                38,
                39,
                40,
                41,
                42,
                43,
                44,
                45,
                46,
                47,
                48,
                49,
                50,
                51,
                52,
                53,
                54
            ],
            "authors": [
                "C.T. Campos",
                "F.E. Jorge"
            ],
            "journal": "Molecular Physics",
            "original": "C. T. Campos and F. E. Jorge, Triple zeta quality basis sets for atoms Rb through Xe: application in CCSD(T) atomic and molecular property calculations Triple zeta quality basis sets for atoms Rb through Xe: application in CCSD(T) atomic and molecular property calculations, Molecular Physics 111, 167 (2013).  ",
            "page": "167-173",
            "title": "Triple zeta quality basis sets for atoms Rb through Xe: application in CCSD(T) atomic and molecular property calculations",
            "valid": true,
            "volume": "111",
            "year": 2013
        }
    ],
    "original": "Elements                             References\n--------                             ----------\nH He Li Be B C N O F Ne Na Mg Al Si P S Cl Ar K Ca Sc Ti V Cr Mn Fe Co Ni Cu Zn Ga Ge As Se Br Kr Rb Sr Y Zr Nb Mo Tc Ru Rh Pd Ag Cd In Sn Sb Te I Xe: F. E. Jorge, A. Canal Neto, G. G. Camiletti, and S. F. Machado, Contracted Gaussian basis sets for Douglas?Kroll?Hess calculations: Estimating scalar relativistic effects of some atomic and molecular properties, Journal of Chemical Physics 130, 064108 (2009).\nRb Sr Y Zr Nb Mo Tc Ru Rh Pd Ag Cd In Sn Sb Te I Xe: C. T. Campos and F. E. Jorge, Triple zeta quality basis sets for atoms Rb through Xe: application in CCSD(T) atomic and molecular property calculations Triple zeta quality basis sets for atoms Rb through Xe: application in CCSD(T) atomic and molecular property calculations, Molecular Physics 111, 167 (2013).\n\n\n",
    "valid": true
}