{
    "citations": [
        {
            "Z": [
                1,
                2,
                3,
                4,
                5,
                6,
                7,
                8,
                9,
                10,
                11,
                12,
                13,
                14,
                15,
                16,
                17,
                18,
                19,
                20,
                32,
                33,
                34,
                35,
                36,
                37,
                38,
                50,
                51,
                52,
                53,
                54,
                55,
                56,
                82,
                83,
                84,
                85,
                86
            ],
            "authors": [
                "N.P. Labello",
                "A.M. Ferreira",
                "H.A. Kurtz"
            ],
            "journal": "and basis set limit molecular polarizability calculations to evaluate an augmented effective core potential basis set. Int. J. Quant. Chem.",
            "orginal": "N.P. Labello, A.M. Ferreira, H.A. Kurtz, An augmented effective core potential basis set for the calculation of molecular polarizabilities., J. Comput. Chem. 26, 1464-1471 (2005), and N.P. Labello, A.M. Ferreira, H.A. Kurtz, Correlated, relativistic, and basis set limit molecular polarizability calculations to evaluate an augmented effective core potential basis set. Int. J. Quant. Chem. 106, 3140-3148 (2006).",
            "page": 3140,
            "title": "An augmented effective core potential basis set for the calculation of molecular polarizabilities., J. Comput. Chem. 26, 1464-1471 (2005), and N.P. Labello, A.M. Ferreira, H.A. Kurtz, Correlated, relativistic",
            "valid": true,
            "volume": 106,
            "year": 2006
        }
    ],
    "original": "Elements                             References\n--------                             ----------\nH He Li Be B C N O F Ne Na Mg Al Si P S Cl Ar K Ca Ge As Se Br Kr Rb Sr Sn Sb Te I Xe Cs Ba Pb Bi Po At Rn : N.P. Labello, A.M. Ferreira, H.A. Kurtz, An augmented effective core potential basis set for the calculation of molecular polarizabilities., J. Comput. Chem. 26, 1464-1471 (2005), and N.P. Labello, A.M. Ferreira, H.A. Kurtz, Correlated, relativistic, and basis set limit molecular polarizability calculations to evaluate an augmented effective core potential basis set.  \r\nInt. J. Quant. Chem. 106, 3140-3148 (2006).\n\n\n",
    "valid": true
}